<Trace  xmlns:xsi='http://www.w3.org/2001/XMLSchema-instance' xsi:noNamespaceSchemaLocation='http://schemas.benchmark-harness.org/Trace.xsd' v='1.01' V='1.08'><ID id='0' name='Loop' type='method' package='TestServer' modifiers=''/><ID id='1' name='Max' type='method' package='TestServer' modifiers='0'/><ID id='2' name='Min' type='method' package='TestServer' modifiers='2|1'/><T _i='0' _m='E'/><T _i='2' _m='E'/><T _i='2' _m='X'/><T _i='2' _m='E'/><T _i='2' _m='X'/><T _i='0' _m='X'/><T _i='0' _m='E'/><T _i='2' _m='E'/><T _i='2' _m='X'/><T _i='0' _m='X'/><T _i='0' _m='E'/><T _i='2' _m='E'/><T _i='2' _m='X'/><T _i='2' _m='E'/><T _i='2' _m='X'/><T _i='0' _m='X'/><T _i='0' _m='E'/><T _i='2' _m='E'/><T _i='2' _m='X'/><T _i='0' _m='X'/><T _i='0' _m='E'/><T _i='2' _m='E'/><T _i='2' _m='X'/><T _i='2' _m='E'/><T _i='2' _m='X'/><T _i='0' _m='X'/><T _i='0' _m='E'/><T _i='2' _m='E'/><T _i='2' _m='X'/><T _i='0' _m='X'/><T _i='0' _m='E'/><T _i='2' _m='E'/><T _i='2' _m='X'/><T _i='2' _m='E'/><T _i='2' _m='X'/><T _i='0' _m='X'/><T _i='0' _m='E'/><T _i='2' _m='E'/><T _i='2' _m='X'/><T _i='0' _m='X'/><T _i='0' _m='E'/><T _i='2' _m='E'/><T _i='2' _m='X'/><T _i='2' _m='E'/><T _i='2' _m='X'/><T _i='0' _m='X'/><T _i='0' _m='E'/><T _i='2' _m='E'/><T _i='2' _m='X'/><T _i='0' _m='X'/><T _i='0' _m='E'/><T _i='2' _m='E'/><T _i='2' _m='X'/><T _i='2' _m='E'/><T _i='2' _m='X'/><T _i='0' _m='X'/><T _i='0' _m='E'/><T _i='2' _m='E'/><T _i='2' _m='X'/><T _i='0' _m='X'/><T _i='0' _m='E'/><T _i='2' _m='E'/><T _i='2' _m='X'/><T _i='2' _m='E'/><T _i='2' _m='X'/><T _i='0' _m='X'/><T _i='0' _m='E'/><T _i='2' _m='E'/><T _i='2' _m='X'/><T _i='0' _m='X'/><T _i='0' _m='E'/><T _i='2' _m='E'/><T _i='2' _m='X'/><T _i='2' _m='E'/><T _i='2' _m='X'/><T _i='0' _m='X'/><T _i='0' _m='E'/><T _i='2' _m='E'/><T _i='2' _m='X'/><T _i='0' _m='X'/><T _i='0' _m='E'/><T _i='2' _m='E'/><T _i='2' _m='X'/><T _i='2' _m='E'/><T _i='2' _m='X'/><T _i='0' _m='X'/><T _i='0' _m='E'/><T _i='2' _m='E'/><T _i='2' _m='X'/><T _i='0' _m='X'/><T _i='0' _m='E'/><T _i='2' _m='E'/><T _i='2' _m='X'/><T _i='2' _m='E'/><T _i='2' _m='X'/><T _i='0' _m='X'/><T _i='0' _m='E'/><T _i='2' _m='E'/><T _i='2' _m='X'/><T _i='0' _m='X'/></Trace>